{
  "schema_id": "orange.tensorrt_engine_manifest",
  "schema_version": 1,
  "created_at_utc": "2026-05-21T18:28:03Z",
  "status": "validated",
  "deployment_runtime": "orange",
  "target_hardware_class": "A16",
  "palette_run_id": "detect_all_available_detect_training_v004_yolo11n_trt_20260520",
  "source": {
    "onnx": {
      "path": "/home/jeremy/orange_data/model_sources/detect/detect_all_available_detect_training_v004_yolo11n_trt_20260520/source.onnx",
      "sha256": "d9bbeebd09ef7a30bc15759b0a149e0de51508735b5c32d9abc247514d950536",
      "palette_manifest_sha256": "d9bbeebd09ef7a30bc15759b0a149e0de51508735b5c32d9abc247514d950536"
    },
    "onnx_manifest": {
      "path": "/home/jeremy/orange_data/model_sources/detect/detect_all_available_detect_training_v004_yolo11n_trt_20260520/source.onnx.manifest.json",
      "sha256": "4d9c573b3b47fa4e69a1f60b76f5931393c15ded32e9206ed3e820efac35a88e"
    },
    "weights": {
      "source_path": "/nvme1/models/detect/detect_all_available_detect_training_v004/detect_all_available_detect_training_v004_yolo11n_trt_20260520/weights/best.pt",
      "sha256": "74458dc7a91b93d70edd7974617b8ad920d30ee78084a56161bcad57dd62ac58"
    },
    "training_manifest": {
      "manifest_path": "/nvme1/training/datasets/detect_all_available_detect_training_v004/detect_all_available_detect_training_v004.manifest.json",
      "manifest_sha256": "6b227f6ae064c8c09fde1a7c4b5bdf045cd25e7d6f8dd624a9f811cbe3307ed3",
      "manifest_dataset_ids": [
        "detect_all_available_detect_training_v004_merged"
      ]
    }
  },
  "engine": {
    "path": "/home/jeremy/orange_data/detect/detect_all_available_detect_training_v004_yolo11n_trt_20260520_a16_gpu5_trt100_fp16_bo5_avg32.engine",
    "sha256": "962579a2e8021409cce58410af1ec2260c399f4e59f17c8ba1a283a85b43d4c8",
    "bytes": 8889572,
    "format": "TensorRT serialized engine",
    "portable": false
  },
  "precision": "fp16",
  "input_contract": {
    "input_name": "images",
    "dtype": "FP32",
    "shape": [
      1,
      3,
      640,
      640
    ],
    "layout": "NCHW",
    "preprocessing": [
      "Mono/luma source frame",
      "letterbox resize to 640x640",
      "padding value 114",
      "divide by 255.0",
      "replicate luma into B, G, R planes",
      "planar NCHW FP32 tensor"
    ]
  },
  "outputs": [
    {
      "name": "num_dets",
      "shape": [
        "1",
        "1"
      ],
      "dtype": "INT32"
    },
    {
      "name": "bboxes",
      "shape": [
        "1",
        "1",
        "4"
      ],
      "dtype": "FLOAT"
    },
    {
      "name": "scores",
      "shape": [
        "1",
        "1"
      ],
      "dtype": "FLOAT"
    },
    {
      "name": "labels",
      "shape": [
        "1",
        "1"
      ],
      "dtype": "INT32"
    }
  ],
  "nms": {
    "conf": 0.3,
    "iou": 0.65,
    "topk": 1
  },
  "plugins": {
    "requires_plugins": true,
    "plugin_ops": [
      "TRT::EfficientNMS_TRT"
    ],
    "plugin_versions": {
      "TRT::EfficientNMS_TRT": "1"
    }
  },
  "build": {
    "tool": "trtexec",
    "trtexec_path": "/usr/local/TensorRT-10.0.1.6/targets/x86_64-linux-gnu/bin/trtexec",
    "tensorrt_version": "10.0.1",
    "tensorrt_log_version": "v100001",
    "cuda_compiler_version": "12.2.140",
    "driver_version": "535.183.06",
    "selected_gpu": {
      "device_id": 5,
      "name": "NVIDIA A16",
      "uuid": "GPU-840b0989-697c-1bf7-84d3-ad5a8c24e898",
      "pci_bus_id": "00000000:45:00.0",
      "compute_capability": "8.6",
      "sm_count": 10,
      "memory_total_mib_nvidia_smi": 15356,
      "device_global_memory_mib_trtexec": 14891
    },
    "fp16": true,
    "builder_optimization_level": 5,
    "avg_timing": 32,
    "profiling_verbosity": "detailed",
    "build_duration_s": 462.694,
    "created_engine_size_mib": 8.47776,
    "command": [
      "/usr/local/TensorRT-10.0.1.6/targets/x86_64-linux-gnu/bin/trtexec",
      "--device=5",
      "--onnx=/home/jeremy/orange_data/detect/detect_all_available_detect_training_v004_yolo11n_trt_20260520.onnx",
      "--saveEngine=/home/jeremy/orange_data/detect/detect_all_available_detect_training_v004_yolo11n_trt_20260520_a16_gpu5_trt100_fp16_bo5_avg32.engine",
      "--fp16",
      "--builderOptimizationLevel=5",
      "--avgTiming=32",
      "--profilingVerbosity=detailed",
      "--exportTimes=/home/jeremy/orange_data/detect/detect_all_available_detect_training_v004_yolo11n_trt_20260520_a16_gpu5_trt100_fp16_bo5_avg32_trtexec_times.json",
      "--exportProfile=/home/jeremy/orange_data/detect/detect_all_available_detect_training_v004_yolo11n_trt_20260520_a16_gpu5_trt100_fp16_bo5_avg32_trtexec_profile.json",
      "--exportLayerInfo=/home/jeremy/orange_data/detect/detect_all_available_detect_training_v004_yolo11n_trt_20260520_a16_gpu5_trt100_fp16_bo5_avg32_trtexec_layer_info.json"
    ],
    "log_path": "/home/jeremy/orange_data/trt_builds/detect/detect_all_available_detect_training_v004_yolo11n_trt_20260520/a16_gpu5_trt100_fp16_bo5_avg32_20260521/detect_all_available_detect_training_v004_yolo11n_trt_20260520_a16_gpu5_trt100_fp16_bo5_avg32_trtexec.log",
    "parser_warnings": [
      "Attribute class_agnostic not found in plugin node; TensorRT used plugin creator default value and engine build passed."
    ]
  },
  "standalone_benchmark": {
    "status": "passed",
    "tool": "trtexec",
    "command": [
      "/usr/local/TensorRT-10.0.1.6/targets/x86_64-linux-gnu/bin/trtexec",
      "--device=5",
      "--loadEngine=/home/jeremy/orange_data/detect/detect_all_available_detect_training_v004_yolo11n_trt_20260520_a16_gpu5_trt100_fp16_bo5_avg32.engine",
      "--duration=10",
      "--warmUp=1000",
      "--exportTimes=/home/jeremy/orange_data/detect/detect_all_available_detect_training_v004_yolo11n_trt_20260520_a16_gpu5_trt100_fp16_bo5_avg32_benchmark_times.json"
    ],
    "duration_s": 10,
    "warmup_ms": 1000,
    "warmup_queries": 411,
    "timing_trace_queries": 4508,
    "timing_trace_duration_s": 10.0049,
    "throughput_qps": 450.58,
    "latency_ms": {
      "min": 2.91016,
      "max": 3.17188,
      "mean": 3.01014,
      "median": 3.00977,
      "p90": 3.02441,
      "p95": 3.02832,
      "p99": 3.03711
    },
    "enqueue_ms": {
      "mean": 1.01596,
      "p95": 1.05859
    },
    "h2d_ms": {
      "mean": 0.785356,
      "p95": 0.787354
    },
    "gpu_compute_ms": {
      "mean": 2.21667,
      "p95": 2.23438,
      "p99": 2.24365
    },
    "d2h_ms": {
      "mean": 0.00810373,
      "p95": 0.00964355
    },
    "total_host_walltime_s": 10.0049,
    "total_gpu_compute_time_s": 9.99276,
    "log_path": "/home/jeremy/orange_data/trt_builds/detect/detect_all_available_detect_training_v004_yolo11n_trt_20260520/a16_gpu5_trt100_fp16_bo5_avg32_20260521/detect_all_available_detect_training_v004_yolo11n_trt_20260520_a16_gpu5_trt100_fp16_bo5_avg32_benchmark.log",
    "times_json_path": "/home/jeremy/orange_data/trt_builds/detect/detect_all_available_detect_training_v004_yolo11n_trt_20260520/a16_gpu5_trt100_fp16_bo5_avg32_20260521/detect_all_available_detect_training_v004_yolo11n_trt_20260520_a16_gpu5_trt100_fp16_bo5_avg32_benchmark_times.json"
  },
  "artifacts": [
    {
      "kind": "trtexec_build_log",
      "path": "/home/jeremy/orange_data/trt_builds/detect/detect_all_available_detect_training_v004_yolo11n_trt_20260520/a16_gpu5_trt100_fp16_bo5_avg32_20260521/detect_all_available_detect_training_v004_yolo11n_trt_20260520_a16_gpu5_trt100_fp16_bo5_avg32_trtexec.log",
      "exists": true,
      "bytes": 14993,
      "sha256": "e908fdf48dc247a3bfbb6b29d8a8550d525210c930d30702f27ab79b46d1dac6"
    },
    {
      "kind": "trtexec_profile_json",
      "path": "/home/jeremy/orange_data/trt_builds/detect/detect_all_available_detect_training_v004_yolo11n_trt_20260520/a16_gpu5_trt100_fp16_bo5_avg32_20260521/detect_all_available_detect_training_v004_yolo11n_trt_20260520_a16_gpu5_trt100_fp16_bo5_avg32_trtexec_profile.json",
      "exists": true,
      "bytes": 36746,
      "sha256": "a5026d41b7dbd5d3ca3114d44cffbf42272032620728dba569248777461c2599"
    },
    {
      "kind": "trtexec_layer_info_json",
      "path": "/home/jeremy/orange_data/trt_builds/detect/detect_all_available_detect_training_v004_yolo11n_trt_20260520/a16_gpu5_trt100_fp16_bo5_avg32_20260521/detect_all_available_detect_training_v004_yolo11n_trt_20260520_a16_gpu5_trt100_fp16_bo5_avg32_trtexec_layer_info.json",
      "exists": true,
      "bytes": 259373,
      "sha256": "f5271a0800b6eae8596680e5823ab8da73aac1aec913525ab4c53278faeeab95"
    },
    {
      "kind": "trtexec_profile_times_json",
      "path": "/home/jeremy/orange_data/trt_builds/detect/detect_all_available_detect_training_v004_yolo11n_trt_20260520/a16_gpu5_trt100_fp16_bo5_avg32_20260521/detect_all_available_detect_training_v004_yolo11n_trt_20260520_a16_gpu5_trt100_fp16_bo5_avg32_trtexec_times.json",
      "exists": false
    },
    {
      "kind": "trtexec_benchmark_log",
      "path": "/home/jeremy/orange_data/trt_builds/detect/detect_all_available_detect_training_v004_yolo11n_trt_20260520/a16_gpu5_trt100_fp16_bo5_avg32_20260521/detect_all_available_detect_training_v004_yolo11n_trt_20260520_a16_gpu5_trt100_fp16_bo5_avg32_benchmark.log",
      "exists": true,
      "bytes": 55328,
      "sha256": "6362a10a645f759e9176e6d5364e3574847a488d0bea91e4598e01b3e8daff42"
    },
    {
      "kind": "trtexec_benchmark_times_json",
      "path": "/home/jeremy/orange_data/trt_builds/detect/detect_all_available_detect_training_v004_yolo11n_trt_20260520/a16_gpu5_trt100_fp16_bo5_avg32_20260521/detect_all_available_detect_training_v004_yolo11n_trt_20260520_a16_gpu5_trt100_fp16_bo5_avg32_benchmark_times.json",
      "exists": true,
      "bytes": 1276723,
      "sha256": "41b8186c7457e2e0ff28745bfe1d9dec79f2ac756eb5316e8c8b446268519c61"
    }
  ],
  "orange_app_validation": {
    "status": "passed",
    "validated_at_utc": "2026-05-21T18:28:55Z",
    "validation_type": "two_camera_headless_external_ipc_ptp_smoke",
    "command": [